{
  "$schema": "https://nbti.app/schemas/questions.schema.json",
  "meta": {
    "totalQuestions": 17,
    "timeEstimate": 240,
    "tags": ["抽象人格", "搞怪测试", "低概率隐藏款", "互联网精神状态"],
    "description": {
      "zh": "共17题。前12题判定常规人格，后5题用于触发低概率隐藏款。请凭第一反应作答，不要太认真，认真就输了。",
      "en": "17 questions. The first 12 determine regular types, and the last 5 can trigger low-probability hidden editions."
    }
  },
  "dimensions": [
    {
      "id": "PT",
      "name": {
        "zh": "常规人格",
        "en": "Personality Type"
      },
      "description": {
        "zh": "用于判定16种常规人格。",
        "en": "Used to determine the 16 regular personality types."
      },
      "leftLabel": {
        "zh": "普通款",
        "en": "Normal"
      },
      "rightLabel": {
        "zh": "抽象款",
        "en": "Absurd"
      }
    },
    {
      "id": "HD",
      "name": {
        "zh": "低概率隐藏款",
        "en": "Hidden Edition"
      },
      "description": {
        "zh": "用于判定5种低概率隐藏款。",
        "en": "Used to determine low-probability hidden editions."
      },
      "leftLabel": {
        "zh": "稳定",
        "en": "Stable"
      },
      "rightLabel": {
        "zh": "稀有",
        "en": "Rare"
      }
    }
  ],
  "categories": [
    {
      "id": "normal-type",
      "name": {
        "zh": "常规人格题",
        "en": "Regular Type Questions"
      },
      "description": {
        "zh": "前12题，核心选项给3分，次要选项给1分。",
        "en": "The first 12 questions. Core options give 3 points, secondary options give 1 point."
      },
      "questionIds": [
        "q001",
        "q002",
        "q003",
        "q004",
        "q005",
        "q006",
        "q007",
        "q008",
        "q009",
        "q010",
        "q011",
        "q012"
      ]
    },
    {
      "id": "hidden-edition",
      "name": {
        "zh": "低概率隐藏款题",
        "en": "Hidden Edition Questions"
      },
      "description": {
        "zh": "后5题，每个选项给对应隐藏款加3分，达到阈值触发隐藏款。",
        "en": "The last 5 questions. Each option adds 3 points to a hidden edition. Reaching the threshold triggers a hidden edition."
      },
      "questionIds": ["q013", "q014", "q015", "q016", "q017"]
    }
  ],
  "questions": [
    {
      "id": "q001",
      "dimension": "PT",
      "category": "normal-type",
      "content": {
        "zh": "周五下班前10分钟，群里突然说：今晚临时开个会。你最像？"
      },
      "required": true,
      "options": [
        {
          "id": "opt_a",
          "content": {
            "zh": "表面还在工位，灵魂已经漂去海边了"
          },
          "weight": {
            "FISH": 3
          },
          "tooltip": {
            "zh": "人在此处，魂已离线。"
          }
        },
        {
          "id": "opt_b",
          "content": {
            "zh": "立刻重排流程，并思考怎么把这会开成项目管理模板"
          },
          "weight": {
            "PLAN": 1
          },
          "tooltip": {
            "zh": "会议还没开，流程图已经长出来了。"
          }
        },
        {
          "id": "opt_c",
          "content": {
            "zh": "好，开吧，人生反正也就这样了"
          },
          "weight": {
            "CHILL": 1
          },
          "tooltip": {
            "zh": "看开，是你最强的护盾。"
          }
        },
        {
          "id": "opt_d",
          "content": {
            "zh": "会能不能解决问题先不说，气氛我得先整起来"
          },
          "weight": {
            "VIBE": 1
          },
          "tooltip": {
            "zh": "结果未知，氛围先赢。"
          }
        }
      ]
    },
    {
      "id": "q002",
      "dimension": "PT",
      "category": "normal-type",
      "content": {
        "zh": "你刚发出一条消息，3秒后突然觉得不太对。你会？"
      },
      "required": true,
      "options": [
        {
          "id": "opt_a",
          "content": {
            "zh": "先撤回，理由之后再编"
          },
          "weight": {
            "UNDO": 3
          },
          "tooltip": {
            "zh": "撤回够快，尴尬就追不上你。"
          }
        },
        {
          "id": "opt_b",
          "content": {
            "zh": "不解释，直接失踪"
          },
          "weight": {
            "GHOST": 3
          },
          "tooltip": {
            "zh": "你不是下线，你是礼貌蒸发。"
          }
        },
        {
          "id": "opt_c",
          "content": {
            "zh": "不但不撤回，甚至还想继续补两句"
          },
          "weight": {
            "TALK": 1
          },
          "tooltip": {
            "zh": "世界不应缺少你的实时评论。"
          }
        },
        {
          "id": "opt_d",
          "content": {
            "zh": "表面镇定，内心已经脑补出后续8集剧情"
          },
          "weight": {
            "HARD": 1
          },
          "tooltip": {
            "zh": "嘴上没事，心里巡演。"
          }
        }
      ]
    },
    {
      "id": "q003",
      "dimension": "PT",
      "category": "normal-type",
      "content": {
        "zh": "截止时间只剩1小时，此时你的状态更接近："
      },
      "required": true,
      "options": [
        {
          "id": "opt_a",
          "content": {
            "zh": "好，终于轮到我真正开始了"
          },
          "weight": {
            "LATE": 3
          },
          "tooltip": {
            "zh": "不逼到悬崖边，绝不启动隐藏性能。"
          }
        },
        {
          "id": "opt_b",
          "content": {
            "zh": "今晚不睡了，我直接修仙"
          },
          "weight": {
            "NITE": 1
          },
          "tooltip": {
            "zh": "夜越深，你越像开了挂。"
          }
        },
        {
          "id": "opt_c",
          "content": {
            "zh": "情绪一上头，灵感开始乱飞"
          },
          "weight": {
            "CRAZY": 1
          },
          "tooltip": {
            "zh": "理智下线，文采上线。"
          }
        },
        {
          "id": "opt_d",
          "content": {
            "zh": "其实我方案早列好了，只是迟迟没动手"
          },
          "weight": {
            "PLAN": 1
          },
          "tooltip": {
            "zh": "方案满分，执行随缘。"
          }
        }
      ]
    },
    {
      "id": "q004",
      "dimension": "PT",
      "category": "normal-type",
      "content": {
        "zh": "你刷到一条朋友圈：\"有些人真的很离谱。\"你的第一反应是？"
      },
      "required": true,
      "options": [
        {
          "id": "opt_a",
          "content": {
            "zh": "快展开说说，我已经坐到前排了"
          },
          "weight": {
            "MELON": 3
          },
          "tooltip": {
            "zh": "不站队，只占最佳观赏位。"
          }
        },
        {
          "id": "opt_b",
          "content": {
            "zh": "这句话背后绝对还有三层潜台词"
          },
          "weight": {
            "DRAMA": 1
          },
          "tooltip": {
            "zh": "别人一句话，你一整季。"
          }
        },
        {
          "id": "opt_c",
          "content": {
            "zh": "看到了，但我决定礼貌消失"
          },
          "weight": {
            "GHOST": 1
          },
          "tooltip": {
            "zh": "信息已接收，人已淡出。"
          }
        },
        {
          "id": "opt_d",
          "content": {
            "zh": "我脑内弹幕已经开始自动滚动了"
          },
          "weight": {
            "TALK": 1
          },
          "tooltip": {
            "zh": "你的大脑自带评论区。"
          }
        }
      ]
    },
    {
      "id": "q005",
      "dimension": "PT",
      "category": "normal-type",
      "content": {
        "zh": "去点奶茶时，店员问你\"今天喝什么\"，你通常会："
      },
      "required": true,
      "options": [
        {
          "id": "opt_a",
          "content": {
            "zh": "每个都不错，所以卡在原地"
          },
          "weight": {
            "MAYBE": 3
          },
          "tooltip": {
            "zh": "你公平地折磨每一个选项。"
          }
        },
        {
          "id": "opt_b",
          "content": {
            "zh": "感觉自己十有八九又会选错"
          },
          "weight": {
            "OOPS": 3
          },
          "tooltip": {
            "zh": "你与正确答案保持礼貌距离。"
          }
        },
        {
          "id": "opt_c",
          "content": {
            "zh": "突然觉得，不喝也挺好"
          },
          "weight": {
            "OFFL": 1
          },
          "tooltip": {
            "zh": "欲望断网，世界清静。"
          }
        },
        {
          "id": "opt_d",
          "content": {
            "zh": "随便吧，活着已经很累了"
          },
          "weight": {
            "CHILL": 1
          },
          "tooltip": {
            "zh": "不争，是你最后的体面。"
          }
        }
      ]
    },
    {
      "id": "q006",
      "dimension": "PT",
      "category": "normal-type",
      "content": {
        "zh": "凌晨1:30，你最可能在做什么？"
      },
      "required": true,
      "options": [
        {
          "id": "opt_a",
          "content": {
            "zh": "人坐在电脑前，魂已经摸去异世界了"
          },
          "weight": {
            "FISH": 3
          },
          "tooltip": {
            "zh": "物理在线，精神远游。"
          }
        },
        {
          "id": "opt_b",
          "content": {
            "zh": "越晚越精神，像突然开了挂"
          },
          "weight": {
            "NITE": 1
          },
          "tooltip": {
            "zh": "月亮是你的启动按钮。"
          }
        },
        {
          "id": "opt_c",
          "content": {
            "zh": "一边发疯，一边写出点很像样的东西"
          },
          "weight": {
            "CRAZY": 3
          },
          "tooltip": {
            "zh": "你把崩溃炼成了文采。"
          }
        },
        {
          "id": "opt_d",
          "content": {
            "zh": "嘴上说\"睡了\"，实际上越熬越清醒"
          },
          "weight": {
            "HARD": 1
          },
          "tooltip": {
            "zh": "嘴硬到连困意都不承认。"
          }
        }
      ]
    },
    {
      "id": "q007",
      "dimension": "PT",
      "category": "normal-type",
      "content": {
        "zh": "朋友聚会突然冷场，你通常会："
      },
      "required": true,
      "options": [
        {
          "id": "opt_a",
          "content": {
            "zh": "主动把场子热起来"
          },
          "weight": {
            "VIBE": 3
          },
          "tooltip": {
            "zh": "气氛不动，你来手动点火。"
          }
        },
        {
          "id": "opt_b",
          "content": {
            "zh": "立刻开启实时评论模式"
          },
          "weight": {
            "TALK": 1
          },
          "tooltip": {
            "zh": "哪里有沉默，哪里就有你的嘴。"
          }
        },
        {
          "id": "opt_c",
          "content": {
            "zh": "往后缩一缩，安静做背景板"
          },